{
  "collection_metadata": {
    "title": "Maamarim Collection - Chassidic Discourses",
    "description": "Collection of Chassidic discourses (Maamarim) with Hebrew text, footnotes, and glossary. Optimized for LLM search.",
    "total_documents": 195,
    "languages": [
      "Hebrew",
      "Aramaic",
      "Yiddish",
      "English"
    ],
    "date_range": "1941-1968",
    "structure_note": "Each document contains main text divided into searchable chunks, footnotes, and glossary sections",
    "conversion_date": "2025-11-07T13:33:30.946772",
    "original_file": "maamarim.txt"
  },
  "document": {
    "id": "1_עז",
    "reference": "Reference: 1_עז",
    "metadata": {
      "hebrew_date": "ט\"ז אדר, ה'תשכ\"ח",
      "gregorian_date": "1968",
      "author": "כ\"ק מו\"ח אדמו\"ר",
      "opening_phrase": "",
      "topics": [
        "שכינה",
        "אור",
        "עצמות",
        "גילוי",
        "עולמות",
        "מלכות",
        "חכמה",
        "בינה",
        "הוד",
        "יסוד",
        "דוד",
        "ישראל",
        "יהודי",
        "יהודים",
        "משכן",
        "מקדש",
        "בית המקדש",
        "קרבנות",
        "קטרת",
        "מצוות",
        "מצוה",
        "תורה",
        "גלות",
        "עבודה",
        "אהבה",
        "מס\"נ",
        "המשכה",
        "תשובה",
        "חסיד",
        "חסידות"
      ],
      "key_concepts": [
        "Shechinah/Divine Presence",
        "Light",
        "Essence",
        "Revelation",
        "Worlds",
        "Kingship",
        "Wisdom",
        "Understanding",
        "Splendor",
        "Foundation",
        "David",
        "Israel",
        "Jew",
        "Jews",
        "Tabernacle",
        "Temple",
        "Holy Temple",
        "Sacrifices",
        "Incense",
        "Commandments",
        "Commandment",
        "Torah",
        "Exile",
        "Service",
        "Love",
        "Self-sacrifice",
        "Drawing down",
        "Repentance",
        "Chassid",
        "Chassidut"
      ],
      "biblical_references": [
        "שה\"ש א, ט",
        "שה\"ש ה, ב",
        "שה\"ש עט, ב"
      ],
      "talmudic_references": [
        "תניא",
        "זהר",
        "זהר",
        "ברכות כו, ב",
        "ברכות ו, ב"
      ],
      "chassidic_references": [
        "אדמו\"ר הזקן",
        "אדמו\"ר הזקן",
        "אדמו\"ר הזקן",
        "אדמו\"ר הצ\"צ",
        "אדמו\"ר מהר\"ש",
        "לקו\"ת",
        "לקו\"ת",
        "תו\"א",
        "תו\"א"
      ],
      "document_type": "מאמר",
      "word_count": 1193,
      "chunk_count": 3
    },
    "content": {
      "main_text": "בס\"ד. ש\"פ תשא, ט\"ז אדר, ה'תשכ\"ח.(הנחה)כי תשא גו', הנה בפרשה זו1 מבואר ענין העבודה במשכן ובמקדש דאקרי משכן2, ענין מעשה הקטרת, שזה הי' מהעבודות העקריות במשכן, ואעפ\"י שגם בפרשה הקודמת, פ' תצוה3, מדובר מענין הקטרת, וכן בפרשה הבאה, פ' ויקהל4, אבל שם מדובר רק בכללות, ובפרשה זו מבואר הענין בפרטות, דהיינו ההכנות לזה, וממה שהי' הקטרת נעשית, וכן גודל הענין שבזה, והלאוים הקשורים בזה וחומר הענין שבהם ועד לענין של היפך החיים להעובר עליהם, אשר גם ענין זה דהיפך החיים מבואר דוקא בפרשה זו מאחר שכאן מבואר חומר הענין, והגם שגם בקרבנות ישנם כו\"כ לאוים כמו חולין בעזרה ושחוטי חוץ וכו', אך אין זה מגיע לקטרת שחמורה כ\"כ עד לענין של היפך החיים להעושה במתכונתה.והנה ענין הקרבנות ומעשה הקטרת ה\"ז עבודת המשכן, וכמשנ\"ת במאמר דיום ההילולא שעיקר העבודה במשכן ומקדש הו\"ע עבודת הקרבנות (שכולל גם מעשה הקטרת), ולכן הי' המשכן מעצי שטים דוקא וכו' (כמבואר שם) ועיכ\"ז נעשה הושכנתי בתוכם, דהנה כללות ענין הקרבנות הו\"ע קירוב כל הכחות5 ועד להקירוב אשר רזא דקורבנא עולה עד רזא דא\"ס6, אך ישנו חילוק בין קרבנות סתם למעשה הקטרת, דקרבנות נקראים אכילה וכמ\"ש7 את קרבני לחמי לאשי גו', ולכן נקראים ישראל רעיתי8, דפי' רעיתי פרנסתי בשני תמידין כו' וכדאיתא במדרש9 ישראל מפרנסין לאביהן שבשמים, משא\"כ מעשה הקטרת הו\"ע הריח, ואע\"פ שמצד ענין ההתכללות שבקדושה הנה גם בקרבנות ישנו ענין הריח, וכמ\"ש ריח ניחוח לה'10 אך בעיקר הקרבנות הם ענין האכילה, וע\"כ היכן מחלקים בין נוקבא דפרדשקא הימנית לפרדשקא השמאלית, גבי קטרת דוקא, כיון שדוקא בקטרת הנה עיקר ענינה הוא הריח, וע\"כ הנה בכח הקטרת דוקא הוא להפך הלעו\"ז, דהנה הקרבנות צ\"ל מן המותר בפיך דוקא, משא\"כ בקטרת ישנו גם ענין המור שזהו\"ע הלעו\"ז וכמו שמבאר אדמו\"ר הזקן11 בענין ששה חדשים בשמן המור ומרדכי מירא דכיא, ולא רק שהמור הוא מלעו\"ז, אלא שכל אחד ואחד מסממני הקטרת קשור עם ענין הלעו\"ז, שהרי בקטרת דוקא י\"א סממנים (ואם חסר א' כו'), היינו שכל אחד מסממני הקטרת הוא אחד מן י\"א, שי\"א הוא ענין הלעו\"ז שאינו (כמו בקדושה ששם הוא) עשר ולא אחד עשר, ועוד שהרי י\"א סממנים אלו הם כנגד י\"א אלופי עשו, דהיינו שכל אחד מסממני הקטרת הוא כנגד אחד מאלופי עשו, וא\"כ כל אחד מן הי\"א סממנים קשור עם ענין הלעו\"ז, שענין הקטרת הוא להפך את הלעו\"ז לקדושה, והכח לזה הוא מאחר שקטרת הו\"ע הריח שמגיע למעלה יותר מקרבנות.והנה מעלת הריח הוא שמגיע בעצם הנפש, וע\"כ בכח הריח, ודוקא ריח חזק, לעורר מהשינה, שזה בכח הריח דוקא ואי\"ז בכח האכילה, ואדרבה, שאכילה גורמת לשינה, וע\"כ איתא במס' יומא12 שהכ\"ג צריך למעט באכילתו בערב יוה\"כ, מפני שהמאכל מביא את השינה, משא\"כ ריח מעורר מהשינה, מאחר שמגיע בעצם הנפש, וזהו מה שעבודת הכה\"ג ביוה\"כ אחת בשנה היתה בקטרת דוקא שהו\"ע הריח, דכמו באדם למטה הנה הריח בכחו לעורר את עצם הנפש, כמו\"כ הוא במקדש שעבודה בריח הוא בקה\"ק, ואע\"פ שהי' נכנס לשם גם עם דם הקרבנות, אך עיקר העבודה בקה\"ק היתה בקטרת, וחידוש מעשה הקטרת ביוה\"כ הוא בקה\"ק, ומצד מעלת ענין הקטרת ע\"כ וכל אדם לא יהי' באהל מועד וגו'13, וגם בכל השנה (שבחסידות מבואר ענין זה לגבי יוה\"כ14 – אבל כן הוא בכל השנה15 מצד מעלת הקטרת), שהו\"ע הריח שמגיע בעצם הנפש, והנה כמו שבגשמיות בכח הריח דוקא לעורר מהשינה כמו\"כ הוא ברוחניות שבכדי לעורר מהשינה הוא ע\"י הריח דוקא, והנה ענין השינה נתבאר במאמר דפורים16 בענין מש\"כ17 אני ישנה ולבי ער קול דודי דופק וגו', והיינו שהגם דכנסת ישראל ישנה בגלותא, אך מאחר שלבי ער, דהיינו שהיחידה שבנפש היא בשלימות וער אצל כאו\"א, ע\"כ קול דודי דופק פתחי לי, בכדי שיהי' אחותי רעיתי יונתי תמתי (והנה במאמר הנ\"ל נתבאר פסוק זה דאני ישנה וגו' והמשך הפסוקים פשטתי את כתנתי וגו', אשר הביאור בהם הוא דלאחר הקול דודי דופק) הנה ע\"ז עונה כנסת ישראל פשטתי את כתנתי איככה אלבשנה, ומביא אדמו\"ר מהר\"ש ואדמו\"ר הצ\"צ ברשימותיו לשה\"ש (עה\"פ18 דודי שלח ידו וגו') דבמד\"ר שה\"ש עה\"פ פשטתי את כתנתי וגו' איתא, דקאי על בגדי כהונה ובגדי מלכות שפשטו ממנו בגלות, דלכאורה אינו מובן השייכות דבגדי כהונה וכו' לכאן, ומבארים, דמאחר שאני ישנה בגלותא וקול דודי דופק לעורר מהשינה, ע\"כ התשובה ע\"ז היא דפשטתי את כתנתי, שחסרים לה הבגדי כהונה כו', ולכן אי אפשר שתהי' עבודת הקרבנות שנק' ריח ניחוח לה', ובפרט מעשה הקטרת שהו\"ע הריח, והריח מעורר מהשינה, ומאחר דפשטתי בגדי כהונה ואין ריח הקרבנות והקטרת, א\"כ איככה אלבשנה להתעורר בבחי' אחותי רעיתי כו', וע\"ז משיבה רוח הקדש בשם הקב\"ה רחצתי את רגלי איככה אטנפם, דהנה ביהמ\"ק נקרא19 הדום רגליו של הקב\"ה, ובביהמ\"ק הי' השראת השכינה, כמ\"ש20 הנה השמים ושמי השמים לא יכלכלוך אף כי הבית הזה, שזו היא תמיהה קימת, אך לאחר שרחצתי את רגלי, אַז איך האָב זיך אָפּגעוואַשן מלהיות מתלבש בבית המקדש, א\"כ איככה כו'.ואע\"פ שגם בזמן הגלות ישנו ענין הקרבנות דתפלות כנגד קרבנות תקנום21, וכמו\"כ ישנו גם ענין הקטרת עכשיו, שזהו ענין תפלת מנחה, שנקראת מנחת קטרת, וכמבואר בהדרושים המבארים מעלת תפלת המנחה על שאר התפלות, ואף אלי' לא נענה אלא בתפלת המנחה22, כמ\"ש בהפטרה דשבת זו23. אך ההמשכה שע\"י התפלה היא רק בפנימיות העולמות, וידוע שההמשכה צריכה להיות גם בחיצוניות העולמות כמבואר בענין התורה שצריך להיות למוציאיהם בפה24 דוקא, וכמו שמאריך אדמו\"ר הזקן בתניא25, וכן במצוות צריך להיות מעשה המצוות דוקא, ועד שכללות ענין התורה ומצות הוא דוקא למטה בעוה\"ז דלמצרים ירדתם26, ובקרבנות אמנם כן הוא שעל ידם הוא גילוי ההמשכה גם בחיצוניות העולמות, משא\"כ ע\"י התפלות דבמקום קרבנות תקנום ההמשכה היא רק בפנימיות העולמות, ולהיות שע\"י המצוות ההמשכה היא בחיצוניות העולמות, הנה ע\"ז עונה כנסת ישראל פשטתי את כתנתי וגו'.וע\"ז ממשיך בהפסוק, דודי שלח ידו מן החור, והיינו שהגם דרוה\"ק משיבה בשם הקב\"ה רחצתי את רגלי איככה גו', אבל מצד הענין דדודי שלח ידו, אשר דודי הו\"ע האהבה עצמית של הקב\"ה לנשמות ישראל (וכמו שמבאר אדמו\"ר הזקן בהמאמר על הפסוק קמתי אני לפתוח לדודי, ונתבאר בשיחת כ\"ק אדמו\"ר (מהורש\"ב) נ\"ע27 ), ומצד האהבה עצמית, הנה שלח ידו מן החור, דחור הוא גם מל' חור כרפס וכן מל' חרות28 ועי\"ז נעשה הפתחי לי, ולאחר הפתחי לי הד' דרגות דאחותי רעיתי יונתי תמתי, שאלו הן ד' מדריגות בין בהעבודה בענין האהבה, דלית פולחנא כפולחנא דרחימותא29, ובין בעבודה דקיום המצוות, דד' מדריגות אלו הן כנגד ד' אותיות דשם הוי'30, ועי\"ז הנה ליהודים היתה אורה ושמחה וששון ויקר31, אשר בד\"א י\"ל שהד' ענינים דאורה ושמחה וגו' הם כנגד הד' אותיות דשם הוי', דאורה זו תורה32 וכמ\"ש33 כי נר מצוה ותורה אור, שזהו\"ע ספירת החכמה, שמחה הו\"ע מועדים31 לשמחה, שהו\"ע ספירת הבינה, וששון זו מילה31 שזהו\"ע ספירת היסוד שהוא עיקר הז\"א, ויקר אלו תפלין31 שהם בחי' המלכות וכמבואר בסוף דשערי אורה34 וכמו שהיא בשרשה בעצמות א\"ס ב\"ה, שזהו מש\"כ בזהר חדש35 שתפלין הם דיוקנאה דחותמי' דמלכא עילאה, דדיוקנא וחותם הו\"ע ספירת המלכות, והיינו שע\"י הפתחי לי נמשך הד' אותיות דשם הוי' בעבודה, וכן בהאורה ושמחה וגו'.וזהו ג\"כ מש\"כ ליהודים היתה אורה וגו' וכמ\"ש בגמרא36 דכל הכופר בע\"ז נק' יהודי, והיינו שקודם ישנו ענין המס\"נ שבזה עמדו אז בימי הפורים, וזהו\"ע הפתחו לי כחודה של מחט שהו\"ע המס\"נ, ואח\"כ הן הד' מדרי' דאורה ושמחה וששון ויקר, וזהו ג\"כ מש\"כ37 איש יהודי הי' בשושן הבירה ושמו מרדכי, דמרדכי מן התורה מנין שנאמר38 מר דרור, ומתרגמינן מירא דכיא39, וכמבואר בתו\"א40, ויהודי הו\"ע המס\"נ כנ\"ל, דיהודי הוא מל' הודאה שלמעלה מטו\"ד, וזה פעל בכולם את ענין המס\"נ שכולם נק' יהודיים דוקא וכבמרז\"ל שזהו היפך מצבם הקודם שהשתחוו לאנדרטי' כמסופר בגמרא41, ואח\"כ נמשך ממס\"נ זה בהד' אותיות דשם הוי', אורה ושמחה וששון וגו' ועד לאורה ושמחה וששון ויקר למטה מעשרה טפחים, כפשוטו של מקרא.",
      "main_text_chunks": [
        {
          "chunk_id": "chunk_1",
          "content": "בס\"ד",
          "topics": [],
          "word_count": 1
        },
        {
          "chunk_id": "chunk_2",
          "content": "ש\"פ תשא, ט\"ז אדר, ה'תשכ\"ח.(הנחה)כי תשא גו', הנה בפרשה זו1 מבואר ענין העבודה במשכן ובמקדש דאקרי משכן2, ענין מעשה הקטרת, שזה הי' מהעבודות העקריות במשכן, ואעפ\"י שגם בפרשה הקודמת, פ' תצוה3, מדובר מענין הקטרת, וכן בפרשה הבאה, פ' ויקהל4, אבל שם מדובר רק בכללות, ובפרשה זו מבואר הענין בפרטות, דהיינו ההכנות לזה, וממה שהי' הקטרת נעשית, וכן גודל הענין שבזה, והלאוים הקשורים בזה וחומר הענין שבהם ועד לענין של היפך החיים להעובר עליהם, אשר גם ענין זה דהיפך החיים מבואר דוקא בפרשה זו מאחר שכאן מבואר חומר הענין, והגם שגם בקרבנות ישנם כו\"כ לאוים כמו חולין בעזרה ושחוטי חוץ וכו', אך אין זה מגיע לקטרת שחמורה כ\"כ עד לענין של היפך החיים להעושה במתכונתה.והנה ענין הקרבנות ומעשה הקטרת ה\"ז עבודת המשכן, וכמשנ\"ת במאמר דיום ההילולא שעיקר העבודה במשכן ומקדש הו\"ע עבודת הקרבנות (שכולל גם מעשה הקטרת), ולכן הי' המשכן מעצי שטים דוקא וכו' (כמבואר שם) ועיכ\"ז נעשה הושכנתי בתוכם, דהנה כללות ענין הקרבנות הו\"ע קירוב כל הכחות5 ועד להקירוב אשר רזא דקורבנא עולה עד רזא דא\"ס6, אך ישנו חילוק בין קרבנות סתם למעשה הקטרת, דקרבנות נקראים אכילה וכמ\"ש7 את קרבני לחמי לאשי גו', ולכן נקראים ישראל רעיתי8, דפי' רעיתי פרנסתי בשני תמידין כו' וכדאיתא במדרש9 ישראל מפרנסין לאביהן שבשמים, משא\"כ מעשה הקטרת הו\"ע הריח, ואע\"פ שמצד ענין ההתכללות שבקדושה הנה גם בקרבנות ישנו ענין הריח, וכמ\"ש ריח ניחוח לה'10 אך בעיקר הקרבנות הם ענין האכילה, וע\"כ היכן מחלקים בין נוקבא דפרדשקא הימנית לפרדשקא השמאלית, גבי קטרת דוקא, כיון שדוקא בקטרת הנה עיקר ענינה הוא הריח, וע\"כ הנה בכח הקטרת דוקא הוא להפך הלעו\"ז, דהנה הקרבנות צ\"ל מן המותר בפיך דוקא, משא\"כ בקטרת ישנו גם ענין המור שזהו\"ע הלעו\"ז וכמו שמבאר אדמו\"ר הזקן11 בענין ששה חדשים בשמן המור ומרדכי מירא דכיא, ולא רק שהמור הוא מלעו\"ז, אלא שכל אחד ואחד מסממני הקטרת קשור עם ענין הלעו\"ז, שהרי בקטרת דוקא י\"א סממנים (ואם חסר א' כו'), היינו שכל אחד מסממני הקטרת הוא אחד מן י\"א, שי\"א הוא ענין הלעו\"ז שאינו (כמו בקדושה ששם הוא) עשר ולא אחד עשר, ועוד שהרי י\"א סממנים אלו הם כנגד י\"א אלופי עשו, דהיינו שכל אחד מסממני הקטרת הוא כנגד אחד מאלופי עשו, וא\"כ כל אחד מן הי\"א סממנים קשור עם ענין הלעו\"ז, שענין הקטרת הוא להפך את הלעו\"ז לקדושה, והכח לזה הוא מאחר שקטרת הו\"ע הריח שמגיע למעלה יותר מקרבנות.והנה מעלת הריח הוא שמגיע בעצם הנפש, וע\"כ בכח הריח, ודוקא ריח חזק, לעורר מהשינה, שזה בכח הריח דוקא ואי\"ז בכח האכילה, ואדרבה, שאכילה גורמת לשינה, וע\"כ איתא במס' יומא12 שהכ\"ג צריך למעט באכילתו בערב יוה\"כ, מפני שהמאכל מביא את השינה, משא\"כ ריח מעורר מהשינה, מאחר שמגיע בעצם הנפש, וזהו מה שעבודת הכה\"ג ביוה\"כ אחת בשנה היתה בקטרת דוקא שהו\"ע הריח, דכמו באדם למטה הנה הריח בכחו לעורר את עצם הנפש, כמו\"כ הוא במקדש שעבודה בריח הוא בקה\"ק, ואע\"פ שהי' נכנס לשם גם עם דם הקרבנות, אך עיקר העבודה בקה\"ק היתה בקטרת, וחידוש מעשה הקטרת ביוה\"כ הוא בקה\"ק, ומצד מעלת ענין הקטרת ע\"כ וכל אדם לא יהי' באהל מועד וגו'13, וגם בכל השנה (שבחסידות מבואר ענין זה לגבי יוה\"כ14 – אבל כן הוא בכל השנה15 מצד מעלת הקטרת), שהו\"ע הריח שמגיע בעצם הנפש, והנה כמו שבגשמיות בכח הריח דוקא לעורר מהשינה כמו\"כ הוא ברוחניות שבכדי לעורר מהשינה הוא ע\"י הריח דוקא, והנה ענין השינה נתבאר במאמר דפורים16 בענין מש\"כ17 אני ישנה ולבי ער קול דודי דופק וגו', והיינו שהגם דכנסת ישראל ישנה בגלותא, אך מאחר שלבי ער, דהיינו שהיחידה שבנפש היא בשלימות וער אצל כאו\"א, ע\"כ קול דודי דופק פתחי לי, בכדי שיהי' אחותי רעיתי יונתי תמתי (והנה במאמר הנ\"ל נתבאר פסוק זה דאני ישנה וגו' והמשך הפסוקים פשטתי את כתנתי וגו', אשר הביאור בהם הוא דלאחר הקול דודי דופק) הנה ע\"ז עונה כנסת ישראל פשטתי את כתנתי איככה אלבשנה, ומביא אדמו\"ר מהר\"ש ואדמו\"ר הצ\"צ ברשימותיו לשה\"ש (עה\"פ18 דודי שלח ידו וגו') דבמד\"ר שה\"ש עה\"פ פשטתי את כתנתי וגו' איתא, דקאי על בגדי כהונה ובגדי מלכות שפשטו ממנו בגלות, דלכאורה אינו מובן השייכות דבגדי כהונה וכו' לכאן, ומבארים, דמאחר שאני ישנה בגלותא וקול דודי דופק לעורר מהשינה, ע\"כ התשובה ע\"ז היא דפשטתי את כתנתי, שחסרים לה הבגדי כהונה כו', ולכן אי אפשר שתהי' עבודת הקרבנות שנק' ריח ניחוח לה', ובפרט מעשה הקטרת שהו\"ע הריח, והריח מעורר מהשינה, ומאחר דפשטתי בגדי כהונה ואין ריח הקרבנות והקטרת, א\"כ איככה אלבשנה להתעורר בבחי' אחותי רעיתי כו', וע\"ז משיבה רוח הקדש בשם הקב\"ה רחצתי את רגלי איככה אטנפם, דהנה ביהמ\"ק נקרא19 הדום רגליו של הקב\"ה, ובביהמ\"ק הי' השראת השכינה, כמ\"ש20 הנה השמים ושמי השמים לא יכלכלוך אף כי הבית הזה, שזו היא תמיהה קימת, אך לאחר שרחצתי את רגלי, אַז איך האָב זיך אָפּגעוואַשן מלהיות מתלבש בבית המקדש, א\"כ איככה כו'.ואע\"פ שגם בזמן הגלות ישנו ענין הקרבנות דתפלות כנגד קרבנות תקנום21, וכמו\"כ ישנו גם ענין הקטרת עכשיו, שזהו ענין תפלת מנחה, שנקראת מנחת קטרת, וכמבואר בהדרושים המבארים מעלת תפלת המנחה על שאר התפלות, ואף אלי' לא נענה אלא בתפלת המנחה22, כמ\"ש בהפטרה דשבת זו23",
          "topics": [
            "שכינה",
            "אור",
            "מלכות",
            "דוד",
            "ישראל"
          ],
          "word_count": 793
        },
        {
          "chunk_id": "chunk_3",
          "content": "אך ההמשכה שע\"י התפלה היא רק בפנימיות העולמות, וידוע שההמשכה צריכה להיות גם בחיצוניות העולמות כמבואר בענין התורה שצריך להיות למוציאיהם בפה24 דוקא, וכמו שמאריך אדמו\"ר הזקן בתניא25, וכן במצוות צריך להיות מעשה המצוות דוקא, ועד שכללות ענין התורה ומצות הוא דוקא למטה בעוה\"ז דלמצרים ירדתם26, ובקרבנות אמנם כן הוא שעל ידם הוא גילוי ההמשכה גם בחיצוניות העולמות, משא\"כ ע\"י התפלות דבמקום קרבנות תקנום ההמשכה היא רק בפנימיות העולמות, ולהיות שע\"י המצוות ההמשכה היא בחיצוניות העולמות, הנה ע\"ז עונה כנסת ישראל פשטתי את כתנתי וגו'.וע\"ז ממשיך בהפסוק, דודי שלח ידו מן החור, והיינו שהגם דרוה\"ק משיבה בשם הקב\"ה רחצתי את רגלי איככה גו', אבל מצד הענין דדודי שלח ידו, אשר דודי הו\"ע האהבה עצמית של הקב\"ה לנשמות ישראל (וכמו שמבאר אדמו\"ר הזקן בהמאמר על הפסוק קמתי אני לפתוח לדודי, ונתבאר בשיחת כ\"ק אדמו\"ר (מהורש\"ב) נ\"ע27 ), ומצד האהבה עצמית, הנה שלח ידו מן החור, דחור הוא גם מל' חור כרפס וכן מל' חרות28 ועי\"ז נעשה הפתחי לי, ולאחר הפתחי לי הד' דרגות דאחותי רעיתי יונתי תמתי, שאלו הן ד' מדריגות בין בהעבודה בענין האהבה, דלית פולחנא כפולחנא דרחימותא29, ובין בעבודה דקיום המצוות, דד' מדריגות אלו הן כנגד ד' אותיות דשם הוי'30, ועי\"ז הנה ליהודים היתה אורה ושמחה וששון ויקר31, אשר בד\"א י\"ל שהד' ענינים דאורה ושמחה וגו' הם כנגד הד' אותיות דשם הוי', דאורה זו תורה32 וכמ\"ש33 כי נר מצוה ותורה אור, שזהו\"ע ספירת החכמה, שמחה הו\"ע מועדים31 לשמחה, שהו\"ע ספירת הבינה, וששון זו מילה31 שזהו\"ע ספירת היסוד שהוא עיקר הז\"א, ויקר אלו תפלין31 שהם בחי' המלכות וכמבואר בסוף דשערי אורה34 וכמו שהיא בשרשה בעצמות א\"ס ב\"ה, שזהו מש\"כ בזהר חדש35 שתפלין הם דיוקנאה דחותמי' דמלכא עילאה, דדיוקנא וחותם הו\"ע ספירת המלכות, והיינו שע\"י הפתחי לי נמשך הד' אותיות דשם הוי' בעבודה, וכן בהאורה ושמחה וגו'.וזהו ג\"כ מש\"כ ליהודים היתה אורה וגו' וכמ\"ש בגמרא36 דכל הכופר בע\"ז נק' יהודי, והיינו שקודם ישנו ענין המס\"נ שבזה עמדו אז בימי הפורים, וזהו\"ע הפתחו לי כחודה של מחט שהו\"ע המס\"נ, ואח\"כ הן הד' מדרי' דאורה ושמחה וששון ויקר, וזהו ג\"כ מש\"כ37 איש יהודי הי' בשושן הבירה ושמו מרדכי, דמרדכי מן התורה מנין שנאמר38 מר דרור, ומתרגמינן מירא דכיא39, וכמבואר בתו\"א40, ויהודי הו\"ע המס\"נ כנ\"ל, דיהודי הוא מל' הודאה שלמעלה מטו\"ד, וזה פעל בכולם את ענין המס\"נ שכולם נק' יהודיים דוקא וכבמרז\"ל שזהו היפך מצבם הקודם שהשתחוו לאנדרטי' כמסופר בגמרא41, ואח\"כ נמשך ממס\"נ זה בהד' אותיות דשם הוי', אורה ושמחה וששון וגו' ועד לאורה ושמחה וששון ויקר למטה מעשרה טפחים, כפשוטו של מקרא",
          "topics": [
            "אור",
            "עצמות",
            "גילוי",
            "עולמות",
            "מלכות"
          ],
          "word_count": 399
        }
      ],
      "footnotes": "* ) המאמר הוגה ע\"י כ\"ק אדמו\"ר שליט\"א.1) ל, לד ואילך.2) עירובין ב, א. וש\"נ.3) ל, ז ואילך.4) לז, כט.5) ספר הבהיר סמ\"ו.6) זח\"ב רלט, א. זח\"ג כו, ב.7) פנחס כח, ב.8) שה\"ש א, ט.9) שהש\"ר א' ע\"פ לסוסתי. זח\"ג ז, ב.10) עטרת ראש לו, ב. ד\"ה וירח ה' את ריח הניחוח תרד\"ע ואילך (המשך תער\"ב ח\"א ע' תלו ואילך). זח\"ג קל, ב. רפט, א.11) בתו\"א דרושי פורים (צב, א. צט, א).12) יח, א.13) אחרי טז, יז.14) אוה\"ת יוה\"כ ד\"ה וכל אדם (ע' א'תקנה ואילך).15) יומא מד, א.16) ד\"ה בלילה ההוא פ\"ב ואילך (לעיל ע' 104 ואילך).17) שה\"ש ה, ב.18) שם, ד.19) דברי הימים-א כח, ב.20) מלכים-א ח, כז.21) ברכות כו, ב.22) ברכות ו, ב.23) מלכים-א יח, לו.24) עירובין נד, א.25) פל\"ז.26) שבת פח, סע\"ב.27) בסה\"ש תורת שלום ליל שמח\"ת תרס\"ו – בהנחת כ\"ק מו\"ח אדמו\"ר (ע' 59 ואילך).28) רשימות הצ\"צ (אוה\"ת שה\"ש ח\"ב ע' תקכט).29) ראה זהר ח\"ב נה, ב. ח\"ג רסז, א. לקו\"ת שלח מב, ג.30) וכמבואר בלקו\"ת שה\"ש (לד, א ואילך) ובמאמר דאדמו\"ר מוהר\"ש דשנת תרכ\"ח (ע' פב [קיא] ואילך).31) מגלת אסתר ח, טז.32) מגילה טז, ב.33) משלי ו, כג.34) מח, ב ואילך.35) שה\"ש עט, ב.36) מגילה יג, רע\"א.37) מג\"א ב, ה.38) תשא ל, כג.39) חולין קלט, ב.40) מג\"א צ, ד.41) מגילה יב, א. תוד\"ה שלא ע\"ז ג, א.",
      "glossary": "|אַז איך האָב זיך אָפּגעוואַשן (Az Ich Hob Zich Opgevashen): So how have I washed myself; אביהן שבשמים (Avihen SheBaShamayim): Their Father in Heaven; אדמו\"ר הזקן (Admor HaZaken): The Alter Rebbe; אדמו\"ר הצ\"צ (Admor HaTzemach Tzedek): The Tzemach Tzedek; אדמו\"ר מהר\"ש (Admor Maharash): The Rebbe Maharash; אורה (Orah): Light; אחד עשר (Achad Asar): Eleven; אחותי רעיתי יונתי תמתי (Achoti Ra'ayati Yonati Tamati): \"My sister, my beloved, my dove, my perfect one\"; אחת בשנה (Achat BaShana): Once a year; אי אפשר (Ee Efshar): Impossible; איככה אטנפם (Eichecha Atanfem): \"How shall I soil them\"; איככה אלבשנה (Eichecha Albeshenah): \"How shall I put it on\"; אינו מובן (Eino Muvan): Not understood; אכילה (Achila): Eating; אלופי עשו (Alufei Esav): Chiefs of Esau; אלי' (Eliyahu): Elijah; אני ישנה ולבי ער (Ani Yesheinah VeLibi Er): \"I sleep but my heart is awake\"; אף כי הבית הזה (Af Ki HaBayit HaZeh): Even this house; את קרבני לחמי (Et Korbani Lachmi): \"My offerings, My bread\"; בגדי כהונה (Bigdei Kehunah): Priestly garments; בגדי מלכות (Bigdei Malchut): Royal garments; בד\"א (BeDibur Acher): In another interpretation; בחי' המלכות (Bechinat HaMalchut): Aspect of Malchut; ביהמ\"ק (Beit HaMikdash): The Temple; במקום קרבנות (BiMkom Korbanot): In place of sacrifices; בס\"ד (Besiyata Dishmaya): With Divine assistance; גילוי (Gilui): Revelation; גלות (Galut): Exile; גלותא (Galuta): Exile; גשמיות (Gashmiyut): Physicality; ד' אותיות דשם הוי' (Dalet Otiyot DeShem Havayah): Four letters of the Tetragrammaton; ד' דרגות (Dalet Dargot): Four levels; ד' מדריגות (Dalet Madregot): Four levels; דודי (Dodi): My beloved; דודי שלח ידו (Dodi Shalach Yado): \"My beloved sent his hand\"; דם הקרבנות (Dam HaKorbanot): Blood of sacrifices; דרושים (Derushim): Homiletical interpretations; ה'תשכ\"ח (Hey Tashkach): Year 5728 (1968); האהבה עצמית (HaAhavah Atzmit): Essential love; הדום רגליו (Hadom Raglav): Footstool; הושכנתי בתוכם (Hoshkanti Betocham): \"I will dwell among them\"; הימנית (Heymanit): Right side; היפך החיים (Heifech HaChaim): Opposite of life; הכנות (Hachanot): Preparations; המשכה (Hamshachah): Divine flow/influence; הנה השמים ושמי השמים (Hineh HaShamayim UShmei HaShamayim): \"Behold, the heavens and the heaven of heavens\"; הנחה (Hanacha): Transcription/notes; הפטרה (Haftarah): Prophetic reading; הקב\"ה (HaKadosh Baruch Hu): The Holy One, Blessed be He; השייכות (HaShayachut): Connection/relevance; השמאלית (HaSmali): Left side; השראת השכינה (Hashratat HaShechina): Dwelling of the Divine Presence; התכללות (Hitkalelut): Integration/inclusion; וכל אדם לא יהי' באהל מועד (VeChol Adam Lo Yihyeh BeOhel Mo'ed): \"No person shall be in the Tent of Meeting\"; זהר חדש (Zohar; זמן הגלות (Zman HaGalut): Time of exile; חולין בעזרה (Chulin Ba'azara): Non-sacred animals in Temple courtyard; חומר הענין (Chomer HaInyan): Severity of the matter; חור כרפס (Chor Karpas): Hole of fine linen; חידוש (Chiddush): Innovation/novelty; חיצוניות העולמות (Chitzoniyut HaOlamot): External aspect of worlds; חסידות (Chassidut): Chassidic teachings; חסר א' (Chaser Echad): Missing one; חסרים לה (Chaserim Lah): Missing from her; חרות (Cherut): Freedom; ט\"ז אדר (Tet-Vav Adar): 16th of Adar; י\"א אלופי עשו (Yud-Alef Alufei Esav): Eleven chiefs of Esau; י\"א סממנים (Yud-Alef Smamanim): Eleven spices; י\"ל (Yesh Lomar): One can say; יוה\"כ (Yom HaKippurim): Day of Atonement; יום ההילולא (Yom HaHillula): Day of celebration/passing; יחידה (Yechida): Highest level of soul; יקר (Yekar): Honor; ישראל רעיתי (Yisrael Ra'ayati): \"Israel My beloved\"; כ\"ג (Kohen Gadol): High Priest; כ\"ק אדמו\"ר (Kevod Kedushat Admor): His Honor and Holiness the Rebbe; כחות (Kochot): Powers/forces; כי נר מצוה ותורה אור (Ki Ner Mitzvah VeTorah Or): \"For a commandment is a lamp and Torah is light\"; כי תשא (Ki Tisa): \"When you take a census\"; כללות (Klalut): General aspect; כנסת ישראל (Knesset Yisrael): Assembly of Israel; לא יכלכלוך (Lo Yechalkelucha): Cannot contain You; לאוים (La'avin): Negative commandments; לאשי (Le'ishai): For My fire offerings; להפך (Lehafech): To transform; ליהודים היתה אורה ושמחה וששון ויקר (LaYehudim Haytah Orah VeSimchah VeSason VeYekar): \"The Jews had light and joy and gladness and honor\"; לית פולחנא כפולחנא דרחימותא (Leit Pulchana KePulchana DeRachimuta): \"There is no service like the service of love\"; לכאורה (Lechorah): Seemingly; למוציאיהם בפה (LeMotziahem BeFeh): To articulate them with the mouth; למטה בעוה\"ז (LeMattah BeOlam HaZeh): Below in this world; למצרים ירדתם (LeMitzrayim Yeradtem): \"You descended to Egypt\"; לעו\"ז (La'avoda Zara): Idolatry; לעורר מהשינה (Le'orer MeHaSheinah): To awaken from sleep; לשמחה (LeSimchah): For joy; מאכל (Ma'achal): Food; מאמר דפורים (Ma'amar DePurim): Purim discourse; מד\"ר (Midrash Rabbah): Midrash Rabbah; מדרש (Midrash): Rabbinic commentary; מהורש\"ב (Maharash\"b): The Rebbe Rashab; מועדים (Mo'adim): Festivals; מור (Mor): Myrrh; מותר בפיך (Mutar BeFicha): Permitted in your mouth; מילה (Milah): Circumcision; מן החור (Min HaChor): From the hole; מנחת קטרת (Minchat Ketoret): Incense offering; מס' יומא (Masechet Yoma): Tractate Yoma; מעלת (Ma'alat): Excellence/superiority; מעלת הריח (Ma'alat HaRe'ach): Excellence of fragrance; מעשה המצוות (Ma'aseh HaMitzvot): Performance of commandments; מפרנסין (Mefarnasim): Sustain/provide for; מקדש (Mikdash): Temple; מרדכי מירא דכיא (Mordechai Mira Dechiya): Mordechai pure myrrh; משכן (Mishkan): Tabernacle; מתכונתה (Mitkunata): Its proper formula; מתלבש (Mitlabesh): Clothed/invested; נ\"ע (Nistar Eden): Of blessed memory; נוקבא דפרדשקא (Nukva DePardeshka): Female aspect of the orchard; נענה (Ne'enah): Was answered; נשמות ישראל (Neshamot Yisrael): Souls of Israel; סממנים (Smamanim): Spices/ingredients; ספירת הבינה (Sefirat HaBinah): Sefirah of Understanding; ספירת החכמה (Sefirat HaChochmah): Sefirah of Wisdom; ספירת היסוד (Sefirat HaYesod): Sefirah of Foundation; עבודה (Avoda): Divine service; עבודות (Avodot): Divine services; עבודת הכה\"ג (Avodat HaKohen HaGadol): Service of the High Priest; עה\"פ (Al HaPasuk): On the verse; עולה (Olah): Ascends; עיקר (Ikar): Primary/main; עיקר הז\"א (Ikar HaZu\"n): Main aspect of Ze'ir Anpin; עצי שטים (Atzei Shittim): Acacia wood; עצם הנפש (Etzem HaNefesh): Essence of the soul; עצמות א\"ס ב\"ה (Atzmut Ein Sof Baruch Hu): Essence of the Infinite, Blessed be He; עקריות (Ikariyot): Primary/essential; ער (Er): Awake; ערב יוה\"כ (Erev Yom HaKippurim): Eve of Yom Kippur; עשר (Eser): Ten; פ' ויקהל (Parshat Vayakhel): Torah portion \"And he assembled\"; פ' תצוה (Parshat Tetzaveh): Torah portion \"Command\"; פנימיות העולמות (Pnimiyut HaOlamot): Inner aspect of worlds; פרטות (Pratut): Specific details; פרנסתי (Parnasati): My sustenance; פרשה (Parsha): Torah portion; פרשה הבאה (Parsha HaBa'ah): Following Torah portion; פרשה הקודמת (Parsha HaKodemet): Previous Torah portion; פשטו ממנו (Pashtu Mimenu): Were removed from him; פשטתי את כתנתי (Pashatti Et Kutanti): \"I have removed my tunic\"; פתחי לי (Pitchi Li): \"Open for me\"; קאי (Ka'i): Refers to; קדושה (Kedusha): Holiness; קה\"ק (Kodesh HaKodashim): Holy of Holies; קול דודי דופק (Kol Dodi Dofek): \"The voice of my beloved knocks\"; קטרת (Ketoret): Incense offering; קיום המצוות (Kiyum HaMitzvot): Fulfillment of commandments; קירוב (Kiruv): Drawing close; קמתי אני לפתוח לדודי (Kamti Ani Lifto'ach LeDodi): \"I arose to open for my beloved\"; קרבנות (Korbanot): Sacrificial offerings; רוה\"ק (Ruach HaKodesh): Divine spirit; רוח הקדש (Ruach HaKodesh): Divine spirit; רוחניות (Ruchaniyut): Spirituality; רזא דא\"ס (Raza De'Ein Sof): Secret of the Infinite; רזא דקורבנא (Raza DeKurbana): Secret of the sacrifice; רחצתי את רגלי (Rachatzti Et Raglai): \"I have washed my feet\"; ריח (Re'ach): Scent/fragrance; ריח חזק (Re'ach Chazak): Strong fragrance; ריח ניחוח לה' (Re'ach Nicho'ach LaHashem): \"A pleasing fragrance to God\"; רשימותיו (Reshimotav): His notes; ש\"פ (Shabbat Parshat): Shabbat of Torah portion; שאר התפלות (She'ar HaTefilot): Other prayers; שבת זו (Shabbat Zo): This Shabbat; שה\"ש (Shir HaShirim): Song of Songs; שחוטי חוץ (Shchutei Chutz): Animals slaughtered outside; שינה (Sheinah): Sleep; שלימות (Shleimut): Completeness; שמחה (Simchah): Joy; שמן המור (Shemen HaMor): Oil of myrrh; שני תמידין (Shnei Tamidim): Two daily offerings; שערי אורה (Sha'arei Orah): Gates of Light; שרשה (Shorshah): Its root; ששה חדשים (Shisha Chadashim): Six months; ששון (Sason): Gladness; תורה (Torah): Torah; תורה ומצות (Torah UMitzvot): Torah and commandments; תמיהה קימת (Temihah Kayemet): Eternal wonder; תניא (Tanya): Foundational Chassidic text; תפלות כנגד קרבנות תקנום (Tefilot Keneged Korbanot Tiknum): \"Prayers were instituted corresponding to sacrifices\"; תפלין (Tefillin): Phylacteries; תפלת מנחה (Tefilat Mincha): Afternoon prayer; תשא (Tisa): Torah portion \"When you take a census\"; תשובה (Teshuva): Answer/response;"
    },
    "search_tags": [
      "מקדש",
      "עבודה",
      "יהודים",
      "Tabernacle",
      "Sacrifices",
      "יסוד",
      "Love",
      "Jews",
      "שכינה",
      "מלכות",
      "Wisdom",
      "Shechinah/Divine Presence",
      "Jew",
      "Temple",
      "בית המקדש",
      "Self-sacrifice",
      "Holy Temple",
      "Commandments",
      "Torah",
      "Splendor",
      "קרבנות",
      "מצוות",
      "דוד",
      "Exile",
      "Israel",
      "ישראל",
      "המשכה",
      "חסידות",
      "תורה",
      "Kingship",
      "Light",
      "בינה",
      "משכן",
      "אהבה",
      "גלות",
      "Understanding",
      "תשובה",
      "אור",
      "עצמות",
      "מס\"נ",
      "מצוה",
      "Essence",
      "Worlds",
      "Foundation",
      "David",
      "הוד",
      "Revelation",
      "Service",
      "יהודי",
      "גילוי",
      "Incense",
      "קטרת",
      "Commandment",
      "עולמות",
      "חסיד",
      "Chassid",
      "Chassidut",
      "Drawing down",
      "Repentance",
      "חכמה"
    ]
  }
}